分野,サービス分類,キーワード,サービス名称,対象者,開始日,終了日,期間備考,無料/有料,導入支援有無,企業等,詳細,発表日付,URL,情報源
食事,現物提供,"弁当,食事,テイクアウト,西部",ふくろいごはん,"個人,袋井市",2020/03/23,,,有料,,袋井飲食店有志,夕飯作りが大変な家庭向けに、袋井市の飲食店の料理を事前予約することでテイクアウトできる。コンビニやチェーン店にない、地元飲食店ならではのメニューを提供。,,https://www.fukuroi-deli.com,ふくろいごはんHP
運動,オンライン,"ジム,運動",自宅で楽しめるトレーニング動画,"個人,親子,家族,夫婦",2020/03/18,,,無料,,株式会社スエヒロ工業「eIGHT GYM」,"新型コロナウイルスの影響により、多くの人が休校や休園、リモートワーク、各施設の運営自粛など、ストレスが溜まっているのでは、と思い、企画しました。
自宅で家族と過ごす“おこもり”を楽しいトレーニングの時間にしたいと、eIGHT GYMのトレーナーが親子・家族・夫婦で楽しめるトレーニング動画をInstagramで投稿します。",2020/03/23,https://www.instagram.com/eight8gym/,＠Press 株式会社スエヒロ工業のプレスリリース
遊び,場所提供,"旅行,電車,バス,観光",新型コロナに負けないツアー,個人,2020/04/05,2020/04/06,両日開催,32800円/1人　小学生以下無料,,大井川鉄道　中井精也（鉄道写真家）,JR静岡駅を出発し、バスで観光名所や撮影スポットを巡りつつ、井川線や蒸気機関車（SL)に乗車する。原則1人参加とし、参加者の検温、車両の窓をできる限り開放するなどの対策を行う。問い合わせはワールドツアーズ（TEL：０３−５９４８−５０８２）まで,2020/03/24,https://www.at-s.com/news/article/topics/shizuoka/749622.html,静岡新聞アットエス
食事,現物提供,"食事, 予約必要,レストラン",0円子ども食堂,"個人,幼稚園,保育園,小学生,中学生",2020/03/17,,水曜日を除く,"無料, 保護者は有料",,タベルーナ・イル・ヴラーノ,"『食を通じて笑顔に』をテーマに毎日（水曜日を除く）営業していますので、お近くの方は是非、ご来店ください。
【特徴】
・衛生的な厨房で作った美味しくて、栄養バランスの整った料理を提供
・経験豊富なイタリアンシェフ在籍
・調理師や栄養士の資格者在籍
・新設できれいな館内、消毒の行き届いた広々とした食事スぺ―ス
【ご注意】
・1日50名様までとなりますので、ご予約優先となります。
・保護者の方も一緒にお食事していただけますが、大人は有料となります。",2020/03/17,https://www.teatel.net/2020/03/17/kodomosyokudou/,公式サイト
学習,現物提供,"詩集,学童保育施設,子ども食堂",学童に「希望を届ける詩集」を贈呈,"学童保育施設,子ども食堂,小中高学校関係者",,,,1施設・団体につき1冊まで　送料無料,,コールサック社,東京都板橋区の出版社「コールサック社」が詩人の谷川俊太郎さんら200人が作品を寄せた「少年少女に希望を届ける詩集」を千冊、希望する学童保育施設などに配布する。子ども食堂や、小中高の学校関係者も贈呈対象となる。問い合わせは同社、電話０３（５９４４）３２５８。,2020/03/25,https://www.at-s.com/news/article/topics/national/749990.html,静岡新聞アットエス
食事,現物提供,"学童支援,キッズ弁当",地域応援 キッズ弁,"個人, 小学生, 中学生, 高校生",2020/03/06,2020/04/30,期間は予定です。状況を考慮して変更もあり。お弁当は店頭販売に加え、配達も承っています。,有料,無,株式会社楽多厨房,"学校がお休みで、お家にいる子供たち・毎日忙しいお母さん達の応援のため
通常価格500円→半額250円でご提供しております。",,https://rakuta.com/,店舗従業員の方より
学習,現物提供,"本屋,マスク,学習スペース",子ども向け手作りマスク無料配布、常時学生の勉強スペース,"個人,小学生中学生高校生",2020/03/28,,在庫がなくなるまで,無料,,高久書店（掛川市）,常連さんが作った子ども向け手作りマスクを無料配布中！学生の勉強スペースもあり。,,https://sites.google.com/view/books-takaku,お店での聞き取り
学習,現物提供,"学習支援、歴史,個人, ぬり絵, デッサン",ぬり絵＆デッサンセット無料プレゼント,個人,2020/03/28,4月下旬まで,,無料,,下田開国博物館,"外出自粛中の皆様にご自宅で楽しんでいただこうと「下田開国博物館お楽しみセット第二弾」として「下岡蓮杖も応援しているよ！　博物館オリジナルぬり絵＆デッサンセット」を新たにご用意いたしました（4月下旬まで）！

　☆無料で！（博物館入館していなくとも）
　☆老若男女どなたでも！
　☆日本全国どちらにお住まいの方でも！

取りに来てくださった方ならどなたでもお渡しいたします。博物館に併設している地酒と地場産品の店「豆州庵」のスタッフにお声がけください。",2020/03/27,https://www.shimoda-museum.jp/new/2020/03/27/1507/,公式サイト
食事,現物提供,"テイクアウト,餃子,個人",テイクアウトメニュー,個人,2020/04/03,,,有料,,ふじ膳,"家飲みの方にもテイクアウトを始めます

ふじ膳 テイクアウトメニュー
餃子 540円
とりから 648円
カキフライ 648円
（税込み価格）

オーダーが混み合う場合もありますので、事前のご連絡をお願いします。",2020/04/03,https://www.facebook.com/fujizen.junko/photos/a.445525095479682/3183492105016287/,ふじ膳Facebook
食事,現物提供,"食事,ドライブスルー,個人",簡易ドライブスルー,個人,2020/04/01,,,有料,,STROKE(ストローク),"コロナの影響が多々ある中で当店では、お車から降りなくていい【簡易ドライブスルー】を始めます！　　
お電話やSNS等のメッセージで、
ご注文&お名前&来店予定時刻を送る
→当店から合計金額の返信
→来店していただき、到着メッセージを送る
→お車まで商品受け渡し、お会計の流れで行こうと思います。
コロナ感染回避だけでなく、小さなお子様がいらっしゃるお客様にも便利かと思います。　
その際、オススメさせていただきたいのが、【キャッシュレス決算】です。
お金はやはり不特定多数の方が触れるの事でリスクがあることと、時間短縮に便利かと思います。
当店では今のところpaypayが使用可能てす。
大変な時期ですが、出来る事からやっていきます。",2020/04/01,https://stroke.amebaownd.com/posts/8005528,STROKE HP
食事,現物提供,"食事,全国,個人",お夕飯便 ”子育て割”,"個人,満3歳～18歳(今年3月卒業の方)のお子様とご両親（保険証や学生証等をご提示いただける方）",2020/03/23,2020/04/30,食材調達、製造・配送体制に限りがある為、お申込み数量が上限に達し次第、終了させていただきます。,有料,,天神屋,"春休み期間中や休校中に各ご家庭でのお食事準備へのサポートとして、期間限定で子育て応援割引「子育て割」を実施いたします。


第1回：3月23日（月）～  4月3日（金）　→申込締切日　3月18日（水）17時迄
第2回：4月6日（月）～4月17日（金）　→申込締切日　3月31日（火）17時迄
第3回：4月20日（月）～4月30日（木）　→申込締切日　4月14日（火）17時迄

対象地域：静岡市葵区駿河区のお夕飯便配送エリア内
販売価格：１食あたり310円（通常価格600円〜）
お支払方法：銀行引き落としもしくは現金払い
お届け方法：お夕飯便スタッフがご自宅までお届け※配達時間は指定できません
申し込み方法：お夕飯便webサイト、もしくはお電話での受付のみ
※店舗での申し込みは行なっておりません。
",2020/03/17,https://tenjinya.com/news/2292,天神屋公式サイトプレスリリース